Bus Hound 6.00 capture on Windows Vista (x64). Complements of www.perisoft.net

  Device - Device ID (followed by the endpoint for USB devices)
            (16) USB Serial Port (COM25)
  Address - FireWire async address or channel number
  Length - Total transfer length
  Phase  - Phase Type
            IN    Data in transfer           
            OUT   Data out transfer          
  Data   - Hex dump of the data transferred
  Descr  - Description of the phase
  Cmd... - Position in the captured data


Device  Address              Length    Phase  Data                      Description       Cmd.Phase.Ofs(rep)
------  -------------------  --------  -----  ------------------------  ----------------  ------------------
  16                               46  OUT    c0 00 08 24  00 00 00 00  ...$....                 1.1.0        
                                              00 07 07 12  20 55 55 55  .... UUU                 1.1.8        
                                              55 55 55 55  55 55 55 55  UUUUUUUU                 1.1.16       
                                              55 55 55 55  55 55 55 55  UUUUUUUU                 1.1.24       
                                              55 55 55 55  55 55 55 55  UUUUUUUU                 1.1.32       
                                              55 55 55 55  55 c0        UUUUU.                   1.1.40       
  16                                1  IN     18                        .                        2.1.0        
  16                               74  IN     02 00 6c 9c  d8 72 df 00  ..l..r..                 3.1.0        
                                              8c 23 02 e2  6e c0 04 88  .#..n...                 3.1.8        
                                              e0 0c 18 8c  0c 1c 82 ec  ........                 3.1.16       
                                              1c 70 8c 7c  8e 82 df 00  .p......                 3.1.24       
                                              ec 38 02 92  df c7 92 dc  .8......                 3.1.32       
                                              e4 6c 1c 70  0c 18 0c f2  .l.p....                 3.1.40       
                                              6e 6e e4 02  c4 3b f2 6e  nn...;.n                 3.1.48       
                                              c4 92 dc e4  0c 1b 82 0c  ........                 3.1.56       
                                              62 8e 23 6c  60 1b 24 60  b.#l`.$`                 3.1.64       
                                              1b fc                     ..                       3.1.72       
  16                               46  OUT    c0 00 08 24  00 00 00 00  ...$....                 4.1.0        
                                              00 07 07 12  20 55 55 55  .... UUU                 4.1.8        
                                              55 55 55 55  55 55 55 55  UUUUUUUU                 4.1.16       
                                              55 55 55 55  55 55 55 55  UUUUUUUU                 4.1.24       
                                              55 55 55 55  55 55 55 55  UUUUUUUU                 4.1.32       
                                              55 55 55 55  55 c0        UUUUU.                   4.1.40       
  16                                1  IN     c0                        .                        5.1.0        
  16                               78  IN     01 08 02 00  07 07 12 20  .......                  6.1.0        
                                              00 00 c0 c0  01 08 02 00  ........                 6.1.8        
                                              07 07 12 20  00 00 c0 c0  ... ....                 6.1.16       
                                              01 08 02 00  07 07 12 20  .......                  6.1.24       
                                              00 00 c0 c0  01 08 02 00  ........                 6.1.32       
                                              07 07 12 20  00 00 c0 c0  ... ....                 6.1.40       
                                              01 08 02 00  07 07 12 20  .......                  6.1.48       
                                              00 00 c0 c0  01 08 02 00  ........                 6.1.56       
                                              07 07 12 20  00 00 c0 c0  ... ....                 6.1.64       
                                              01 08 02 00  07 07        ......                   6.1.72       
  16                                1  IN     12                        .                        7.1.0        
  16                               16  IN     20 00 00 c0  c0 01 08 02   .......                 8.1.0        
                                              00 07 07 12  20 00 00 c0  .... ...                 8.1.8        
  16                               26  OUT    c0 00 09 10  00 00 00 00  ........                 9.1.0        
                                              00 04 08 00  60 20 00 00  ....` ..                 9.1.8        
                                              00 30 01 00  00 0a 00 00  .0......                 9.1.16       
                                              00 c0                     ..                       9.1.24       
  16                                1  IN     c0                        .                       10.1.0        
  16                               11  IN     01 09 02 00  07 07 12 20  .......                 11.1.0        
                                              00 00 c0                  ...                     11.1.8        
  16                               26  OUT    c0 00 09 10  00 00 00 00  ........                12.1.0        
                                              00 08 08 00  60 20 00 00  ....` ..                12.1.8        
                                              00 30 01 00  00 0a 00 00  .0......                12.1.16       
                                              00 c0                     ..                      12.1.24       
  16                                1  IN     c0                        .                       13.1.0        
  16                               11  IN     01 09 02 00  07 07 12 20  .......                 14.1.0        
                                              00 00 c0                  ...                     14.1.8        
  16                               26  OUT    c0 00 09 10  00 00 00 00  ........                15.1.0        
                                              00 0c 08 00  60 20 00 00  ....` ..                15.1.8        
                                              00 30 01 00  00 0a 00 00  .0......                15.1.16       
                                              00 c0                     ..                      15.1.24       
  16                                1  IN     c0                        .                       16.1.0        
  16                               11  IN     01 09 02 00  07 07 12 20  .......                 17.1.0        
                                              00 00 c0                  ...                     17.1.8        
  16                               26  OUT    c0 00 09 10  00 00 00 00  ........                18.1.0        
                                              00 10 08 00  60 20 00 00  ....` ..                18.1.8        
                                              00 30 01 00  00 0a 00 00  .0......                18.1.16       
                                              00 c0                     ..                      18.1.24       
  16                                1  IN     c0                        .                       19.1.0        
  16                               11  IN     01 09 02 00  07 07 12 20  .......                 20.1.0        
                                              00 00 c0                  ...                     20.1.8        
  16                               26  OUT    c0 00 09 10  00 00 00 00  ........                21.1.0        
                                              00 28 00 f0  3f 02 00 00  .(..?...                21.1.8        
                                              00 02 00 00  00 0a 00 00  ........                21.1.16       
                                              00 c0                     ..                      21.1.24       
  16                                1  IN     c0                        .                       22.1.0        
  16                               11  IN     01 09 02 00  07 07 12 20  .......                 23.1.0        
                                              00 00 c0                  ...                     23.1.8        
  16                               26  OUT    c0 00 09 10  00 00 00 00  ........                24.1.0        
                                              00 00 08 00  60 00 00 00  ....`...                24.1.8        
                                              00 00 03 00  00 0a 00 00  ........                24.1.16       
                                              00 c0                     ..                      24.1.24       
  16                                1  IN     c0                        .                       25.1.0        
  16                               11  IN     01 09 02 00  07 07 12 20  .......                 26.1.0        
                                              00 00 c0                  ...                     26.1.8        
  16                               26  OUT    c0 00 02 10  00 00 00 00  ........                27.1.0        
                                              00 00 00 00  00 00 00 00  ........                27.1.8        
                                              00 00 04 00  00 00 00 00  ........                27.1.16       
                                              00 c0                     ..                      27.1.24       
  16                                1  IN     c0                        .                       28.1.0        
  16                               11  IN     01 02 02 00  07 07 12 20  .......                 29.1.0        
                                              00 00 c0                  ...                     29.1.8        
  16                               26  OUT    c0 00 05 10  00 00 00 00  ........                30.1.0        
                                              00 3c 1f 00  00 02 00 00  .<......                30.1.8        
                                              00 00 18 00  00 00 00 10  ........                30.1.16       
                                              40 c0                     @.                      30.1.24       
  16                                1  IN     c0                        .                       31.1.0        
  16                               11  IN     01 05 02 00  07 07 12 20  .......                 32.1.0        
                                              00 00 c0                  ...                     32.1.8        
  16                             6269  OUT    c0 00 07 10  18 1a 00 00  ........                33.1.0        
                                              00 00 18 00  00 00 00 00  ........                33.1.8        
                                              00 00 00 00  00 00 00 00  ........                33.1.16       
                                              00 a8 10 00  40 01 ff ff  ....@...                33.1.24       
                                              46 45 00 00  00 00 80 fe  FE......                33.1.32       
                                              3f 4f 48 41  49 a4 ab ff  ?OHAI...                33.1.40       
                                              3f 0c ab fe  3f 80 80 00  ?...?...                33.1.48       
                                              00 c4 19 10  40 0c 00 00  ....@...                33.1.56       
                                              60 00 00 00  01 00 00 01  `.......                33.1.64       
                                              00 00 10 00  00 ff ff 00  ........                33.1.72       
                                              00 8c 80 00  00 10 40 00  ......@.                33.1.80       
                                              00 00 00 ff  ff 00 40 00  ......@.                33.1.88       
                                              00 00 80 fe  3f 9c 2b ff  ....?.+.                33.1.96       
                                              3f a0 2b ff  3f 10 27 00  ?.+.?.'.                33.1.104      
                                              00 14 00 00  60 ff ff 0f  ....`...                33.1.112      
                                              00 a4 ab ff  3f a4 ab ff  ....?...                33.1.120      
                                              3f a4 2b ff  3f b4 ab ff  ?.+.?...                33.1.128      
                                              3f 00 80 00  00 20 29 00  ?.... ).                33.1.136      
                                              00 f8 8d fe  3f 58 80 fe  ....?X..                33.1.144      
                                              3f a8 ab ff  3f 98 ae ff  ?...?...                33.1.152      
                                              3f 98 9b fe  3f 84 ae ff  ?...?...                33.1.160      
                                              3f 80 1b 00  00 a0 0d 00  ?.......                33.1.168      
                                              00 00 08 00  00 20 09 00  ..... ..                33.1.176      
                                              00 50 0e 00  00 50 12 00  .P...P..                33.1.184      
                                              00 ac ab ff  3f b0 ab ff  ....?...                33.1.192      
                                              3f 1f 29 00  00 3c a9 fe  ?.)..<..                33.1.200      
                                              3f 08 ae ff  3f 8c ad ff  ?...?...                33.1.208      
                                              3f 80 0b 00  00 0c ad ff  ?.......                33.1.216      
                                              3f 8c ac ff  3f b0 15 00  ?...?...                33.1.224      
                                              00 f1 ff 00  00 00 ab fe  ........                33.1.232      
                                              3f 00 a9 fe  3f bc 0f 00  ?...?...                33.1.240      
                                              40 88 0f 00  40 a8 0f 00  @...@...                33.1.248      
                                              40 58 3f 00  40 2c 4c 00  @X?.@,L.                33.1.256      
                                              40 30 3b 00  40 78 48 00  @0;.@xH.                33.1.264      
                                              40 00 4a 00  40 b4 49 00  @.J.@.I.                33.1.272      
                                              40 cc 2e 00  40 1c e2 00  @...@...                33.1.280      
                                              40 d8 39 00  40 68 e2 00  @.9.@h..                33.1.288      
                                              40 48 df 00  40 90 e1 00  @H..@...                33.1.296      
                                              40 4c 26 00  40 84 49 00  @L&.@.I.                33.1.304      
                                              40 21 bc ff  92 a1 10 90  @!......                33.1.312      
                                              11 db dc 22  61 23 22 a0  ..."a#".                33.1.320      
                                              00 02 61 43  c2 61 42 d2  ..aC.aB.                33.1.328      
                                              61 41 e2 61  40 f2 61 3f  aA.a@.a?                33.1.336      
                                              01 e7 ff db  dc 00 00 21  .......!                33.1.344      
                                              b2 ff 31 b3  ff 0c 04 06  ..1.....                33.1.352      
                                              01 00 00 49  02 4b 22 37  ...I.K"7                33.1.360      
                                              32 f8 22 a0  8c 2a 21 0c  2."..*!.                33.1.368      
                                              43 05 b1 01  21 ae ff c1  C...!...                33.1.376      
                                              ad ff 31 ae  ff 2a 2c db  ..1..*,.                33.1.384      
                                              dc 20 00 c9  02 42 a0 00  . ...B..                33.1.392      
                                              22 a0 05 01  da ff db dc  ".......                33.1.400      
                                              00 00 21 a9  ff 32 a1 01  ..!..2..                33.1.408      
                                              db dc 20 00  48 02 30 34  .. .H.04                33.1.416      
                                              20 db dc 20  00 39 02 2c   .. .9.,                33.1.424      
                                              02 01 d4 ff  db dc 00 00  ........                33.1.432      
                                              01 d4 ff db  dc 00 00 31  .......1                33.1.440      
                                              a2 ff 41 a2  ff 51 a3 ff  ..A..Q..                33.1.448      
                                              71 a3 ff 0c  02 62 a1 00  q....b..                33.1.456      
                                              01 cf ff db  dc 00 00 31  .......1                33.1.464      
                                              a0 ff 21 98  ff 3a 32 db  ..!..:2.                33.1.472      
                                              dc 20 00 28  03 16 72 ff  . .(..r.                33.1.480      
                                              db dc 20 00  c8 03 0c 02  .. .....                33.1.488      
                                              db dc 20 00  29 03 0c 13  .. .)...                33.1.496      
                                              32 41 84 32  0c 01 22 51  2A.2.."Q                33.1.504      
                                              43 32 41 85  22 61 22 66  C2A."a"f                33.1.512      
                                              93 18 22 0c  03 32 0c 02  .."..2..                33.1.520      
                                              80 22 11 30  22 20 66 42  .".0" fB                33.1.528      
                                              09 28 2c db  dc 20 00 28  .(,.. .(                33.1.536      
                                              02 22 61 22  22 a0 db dc  ."a""...                33.1.544      
                                              01 bb ff db  dc 00 00 22  ......."                33.1.552      
                                              a0 84 10 22  80 32 a0 08  ...".2..                33.1.560      
                                              45 a3 01 f2  0c 03 22 0c  E.....".                33.1.568      
                                              02 80 ff 11  20 ff 20 21  .... . !                33.1.576      
                                              87 ff f7 b2  17 05 9d 01  ........                33.1.584      
                                              22 a0 ee 01  b1 ff db dc  ".......                33.1.592      
                                              00 00 22 a0  db dc 01 af  ..".....                33.1.600      
                                              ff db dc 00  00 c6 dd ff  ........                33.1.608      
                                              32 0c 01 0c  d2 27 93 02  2....'..                33.1.616      
                                              c6 85 00 37  32 51 66 63  ...72Qfc                33.1.624      
                                              02 86 9e 00  f6 73 23 66  .....s#f                33.1.632      
                                              33 02 46 5d  00 f6 43 0a  3.F]..C.                33.1.640      
                                              66 23 02 86  4c 00 06 9d  f#..L...                33.1.648      
                                              00 00 00 66  43 02 46 71  ...fC.Fq                33.1.656      
                                              00 66 53 02  c6 83 00 c6  .fS.....                33.1.664      
                                              98 00 00 0c  92 27 93 02  .....'..                33.1.672      
                                              06 7a 00 37  32 08 66 73  .z.72.fs                33.1.680      
                                              02 c6 80 00  86 93 00 66  .......f                33.1.688      
                                              93 02 46 78  00 0c b2 27  ..Fx...'                33.1.696      
                                              93 02 46 6d  00 46 8f 00  ..Fm.F..                33.1.704      
                                              1c 32 27 93  02 c6 39 00  .2'...9.                33.1.712      
                                              37 32 28 66  b3 02 86 40  72(f...@                33.1.720      
                                              00 1c 02 37  32 0a 0c f2  ...72...                33.1.728      
                                              27 93 02 06  2e 00 06 87  '.......                33.1.736      
                                              00 1c 12 27  93 02 46 42  ...'..FB                33.1.744      
                                              00 1c 22 27  93 02 46 59  .."'..FY                33.1.752      
                                              00 46 82 00  22 a0 d1 27  .F.."..'                33.1.760      
                                              13 2c 37 32  09 22 a0 d0  .,72."..                33.1.768      
                                              27 13 18 c6  7d 00 00 22  '......"                33.1.776      
                                              a0 d2 27 93  02 86 25 00  ..'...%.                33.1.784      
                                              22 a0 d3 27  93 02 86 92  "..'....                33.1.792      
                                              05 46 78 00  0c 1d cc 1f  .Fx.....                33.1.800      
                                              c6 5c 05 06  74 00 00 66  .\..t..f                33.1.808      
                                              8f 02 46 5d  05 06 71 00  ..F]..q.                33.1.816      
                                              00 01 79 ff  db dc 00 00  ..y.....                33.1.824      
                                              ea ed 9c 12  86 6d 00 00  .....m..                33.1.832      
                                              20 2c 41 01  76 ff db dc   ,A.v...                33.1.840      
                                              00 00 56 92  1a d2 dd f0  ..V.....                33.1.848      
                                              d0 2e db dc  8c 4d 20 30  .....M 0                33.1.856      
                                              f4 56 53 fe  da f2 e1 3d  .VS....=                33.1.864      
                                              ff 06 04 00  00 00 20 20  ......                  33.1.872      
                                              f5 01 6e ff  db dc 00 00  ..n.....                33.1.880      
                                              56 52 18 e0  dd db dc d0  VR......                33.1.888      
                                              2f db dc d7  3e ea da e2  /...>...                33.1.896      
                                              06 04 00 00  00 20 2c 41  ..... ,A                33.1.904      
                                              01 66 ff db  dc 00 00 56  .f.....V                33.1.912      
                                              92 16 d2 dd  f0 d0 2e db  ........                33.1.920      
                                              dc 56 ad fe  c6 57 00 0c  .V...W..                33.1.928      
                                              0e d2 a0 db  dc 26 8f 02  .....&..                33.1.936      
                                              46 58 00 86  62 05 00 00  FX..b...                33.1.944      
                                              66 bf 02 86  60 05 06 3b  f...`..;                33.1.952      
                                              00 66 bf 02  86 3f 05 c6  .f...?..                33.1.960      
                                              4e 00 0c 1d  26 bf 02 46  N...&..F                33.1.968      
                                              4d 00 38 4c  21 29 ff 0c  M.8L!)..                33.1.976      
                                              0e d2 a0 c2  27 13 02 86  ....'...                33.1.984      
                                              4c 00 46 3b  05 0c 14 66  L.F;...f                33.1.992      
                                              bf 12 38 4c  21 23 ff 0c  ..8L!#..                33.1.1000     
                                              0e d2 a0 c2  27 13 02 86  ....'...                33.1.1008     
                                              46 00 c6 3a  05 dd 04 46  F..:...F                33.1.1016     
  16                                1  IN     c0                        .                       34.1.0        
  16                               11  IN     01 07 02 00  07 07 12 20  .......                 35.1.0        
                                              00 00 c0                  ...                     35.1.8        
  16                             1945  OUT    c0 00 07 4c  07 e0 00 00  ...L....                36.1.0        
                                              00 3c 07 00  00 01 00 00  .<......                36.1.8        
                                              00 00 00 00  00 00 00 00  ........                36.1.16       
                                              00 07 2d 07  85 33 00 c9  ..-..3..                36.1.24       
                                              0d 82 21 2b  c1 0f fa cc  ..!+....                36.1.32       
                                              48 d6 8e 01  46 03 00 28  H...F..(                36.1.40       
                                              3c 16 42 ff  a6 1e 02 c6  <.B.....                36.1.48       
                                              65 fb c6 fa  ff 22 a0 c7  e...."..                36.1.56       
                                              29 5c c6 03  00 cc ce 28  )\.....(                36.1.64       
                                              3c cc 12 c6  5f fa 22 a0  <..._.".                36.1.72       
                                              c8 86 02 00  00 28 3c 8c  .....(<.                36.1.80       
                                              12 46 5c fa  22 a0 c9 29  .F\."..)                36.1.88       
                                              5c 46 5a fa  00 28 2c 8c  \FZ..(,.                36.1.96       
                                              12 46 58 fa  21 00 fa 01  .FX.!...                36.1.104      
                                              2a fa db dc  00 00 01 2f  *....../                36.1.112      
                                              fa db dc 00  00 c6 53 fa  ......S.                36.1.120      
                                              00 28 3c cc  12 c6 51 fa  .(<...Q.                36.1.128      
                                              db dc 02 00  46 50 fa 00  ....FP..                36.1.136      
                                              01 2a fa db  dc 00 00 20  .*.....                 36.1.144      
                                              df 83 c6 9f  fa e8 2c d8  ......,.                36.1.152      
                                              3c e0 2d 20  20 20 b4 8c  <.-   ..                36.1.160      
                                              12 86 10 fb  c6 9e fa 28  .......(                36.1.168      
                                              2c 38 3c c5  5c 00 c6 02  ,8<.\...                36.1.176      
                                              00 00 00 00  22 2c 02 32  ....",.2                36.1.184      
                                              2c 05 c5 30  00 d2 a0 00  ,..0....                36.1.192      
                                              0c 13 20 d3  93 06 08 fb  .. .....                36.1.200      
                                              00 00 32 2c  05 22 2c 02  ..2,.",.                36.1.208      
                                              d2 2c 03 42  61 30 05 2f  .,.Ba0./                36.1.216      
                                              00 31 e1 f9  42 21 30 20  .1..B!0                 36.1.224      
                                              dd 11 e9 63  32 d3 2b d9  ...c2.+.                36.1.232      
                                              23 20 4e 83  86 bb fa 28  # N....(                36.1.240      
                                              2c 38 3c 48  4c 58 5c 68  ,8<HLX\h                36.1.248      
                                              6c 78 7c 0c  0d 01 01 fa  lx......                36.1.256      
                                              db dc 00 00  ed 02 0c 12  ........                36.1.264      
                                              e0 d2 93 06  fa fa 01 fc  ........                36.1.272      
                                              f9 db dc 00  00 0c 0d 06  ........                36.1.280      
                                              f4 fa 00 28  2c 38 3c db  ...(,8<.                36.1.288      
                                              dc 20 00 39  02 0c 0e dd  . .9....                36.1.296      
                                              0e 06 f3 fa  21 ce f9 48  ....!..H                36.1.304      
                                              5c 38 2c 49  02 21 cc f9  \8,I.!..                36.1.312      
                                              39 02 06 f6  ff 41 ca f9  9....A..                36.1.320      
                                              0c 02 58 04  32 a0 c8 29  ..X.2..)                36.1.328      
                                              04 41 c6 f9  50 32 83 0c  .A..P2..                36.1.336      
                                              1d 29 04 30  d2 83 86 e4  .).0....                36.1.344      
                                              fa 02 21 43  92 a1 10 c2  ..!C....                36.1.352      
                                              21 42 d2 21  41 e2 21 40  !B.!A.!@                36.1.360      
                                              f2 21 3f 9a  11 0d f0 00  .!?.....                36.1.368      
                                              f8 02 00 60  10 02 00 60  ...`...`                36.1.376      
                                              00 02 00 60  00 00 00 08  ...`....                36.1.384      
                                              31 fc ff db  dc 20 00 28  1.... .(                36.1.392      
                                              03 20 20 24  56 42 ff 31  .  $VB.1                36.1.400      
                                              f9 ff 41 fa  ff db dc 20  ..A....                 36.1.408      
                                              00 29 03 21  f7 ff db dc  .).!....                36.1.416      
                                              20 00 49 02  db dc 20 00   .I... .                36.1.424      
                                              48 02 56 74  ff db dc 20  H.Vt...                 36.1.432      
                                              00 38 03 0c  12 30 30 04  .8...00.                36.1.440      
                                              20 23 30 0d  f0 08 00 00   #0.....                36.1.448      
                                              60 1c 00 00  60 00 00 00  `...`...                36.1.456      
                                              60 94 2b ff  3f 84 80 00  `.+.?...                36.1.464      
                                              00 40 40 00  00 4c eb fe  .@@..L..                36.1.472      
                                              3f 10 00 00  60 98 2b ff  ?...`.+.                36.1.480      
                                              3f 21 f7 ff  12 c1 f0 d9  ?!......                36.1.488      
                                              11 db dc 20  00 d8 02 09  ... ....                36.1.496      
                                              31 c9 21 21  f3 ff db dc  1.!!....                36.1.504      
                                              20 00 c2 22  00 db dc db   .."....                36.1.512      
                                              dc 74 16 7c  09 31 f1 ff  .t...1..                36.1.520      
                                              db dc 20 00  22 23 00 31  .. ."#.1                36.1.528      
                                              ef ff 20 20  74 85 4f 00  ..  t.O.                36.1.536      
                                              32 af fe 96  72 03 31 87  2...r.1.                36.1.544      
                                              f9 41 87 f9  20 20 74 40  .A..  t@                36.1.552      
                                              43 80 db dc  20 00 58 04  C... .X.                36.1.560      
                                              41 e8 ff 4a  33 42 13 00  A..J3B..                36.1.568      
                                              40 40 f4 1b  64 60 60 f4  @@..d``.                36.1.576      
                                              db dc 20 00  62 53 00 4a  .. .bS.J                36.1.584      
                                              45 db dc 20  00 22 44 00  E.. ."D.                36.1.592      
                                              32 13 00 21  e1 ff 30 30  2..!..00                36.1.600      
                                              f4 27 93 3c  21 78 f9 31  .'.<!x.1                36.1.608      
                                              78 f9 41 e0  ff 3a 32 db  x.A..:2.                36.1.616      
                                              dc 20 00 68  03 51 dc ff  . .h.Q..                36.1.624      
                                              27 96 0f c6  ff ff db dc  '.......                36.1.632      
                                              20 00 29 04  db dc 20 00   .)... .                36.1.640      
                                              59 03 46 02  00 db dc 20  Y.F....                 36.1.648      
                                              00 59 04 db  dc 20 00 29  .Y... .)                36.1.656      
                                              03 31 d2 ff  3a 22 0c 03  .1..:"..                36.1.664      
                                              db dc 20 00  32 52 00 0b  .. .2R..                36.1.672      
                                              cc 56 ac f6  06 d6 ff 21  .V.....!                36.1.680      
                                              d0 ff 08 31  db dc 20 00  ...1.. .                36.1.688      
                                              d9 02 c8 21  d8 11 12 c1  ...!....                36.1.696      
                                              10 0d f0 00  00 00 80 00  ........                36.1.704      
                                              00 00 00 40  ff ff ff 00  ...@....                36.1.712      
                                              04 02 00 60  12 c1 f0 c2  ...`....                36.1.720      
                                              61 02 c1 68  f9 02 61 03  a..h..a.                36.1.728      
                                              22 2c 04 16  a2 07 45 eb  ",....E.                36.1.736      
                                              ff 16 42 07  c5 ea ff 16  ..B.....                36.1.744      
                                              92 ff 21 a8  ff 31 f4 ff  ..!..1..                36.1.752      
                                              db dc 20 00  39 02 db dc  .. .9...                36.1.760      
                                              20 00 38 02  56 73 ff 28   .8.Vs.(                36.1.768      
                                              4c 0c f3 27  23 07 0c 12  L..'#...                36.1.776      
                                              41 53 f9 06  03 00 28 2c  AS....(,                36.1.784      
                                              20 20 34 56  f2 fe 41 ea    4V..A.                36.1.792      
                                              ff 1c 02 58  2c 61 9a ff  ...X,a..                36.1.800      
                                              40 55 11 db  dc 20 00 32  @U... .2                36.1.808      
                                              26 00 30 30  24 56 33 ff  &.00$V3.                36.1.816      
                                              31 e5 ff 30  55 10 31 e5  1..0U.1.                36.1.824      
                                              ff db dc 20  00 59 03 31  ... .Y.1                36.1.832      
                                              94 ff db dc  20 00 42 63  .... .Bc                36.1.840      
                                              00 db dc 20  00 48 03 56  ... .H.V                36.1.848      
                                              74 ff 38 4c  20 33 db dc  t.8L 3..                36.1.856      
                                              39 4c 38 2c  3a 22 29 2c  9L8,:"),                36.1.864      
                                              08 31 c8 21  12 c1 10 0d  .1.!....                36.1.872      
                                              f0 00 00 4c  4a 00 40 12  ...LJ.@.                36.1.880      
                                              c1 e0 c9 61  c1 41 f9 d9  ...a.A..                36.1.888      
                                              51 48 3c e9  41 09 71 f9  QH<.A.q.                36.1.896      
                                              31 ed 02 dd  03 37 b4 02  1....7..                36.1.904      
                                              40 d4 20 16  5d 04 f8 1c  @. .]...                36.1.912      
                                              fa fd f0 fc  41 86 00 00  ....A...                36.1.920      
                                              85 f3 ff 28  4c e6 12 0a  ...(L...                36.1.928      
                                              85 df ff 16  92 ff 86 02  ........                36.1.936      
                                              00 00 00 28  2c 27 af e7  ...(,'..                36.1.944      
                                              06 fb ff 00  28 1c 3d 0e  ....(.=.                36.1.952      
                                              4d 0d 01 ec  ff db dc 00  M.......                36.1.960      
                                              00 8c 32 22  a0 c4 29 5c  ..2"..)\                36.1.968      
                                              28 1c 2a 2d  29 1c 28 3c  (.*-).(<                36.1.976      
                                              d0 d2 db dc  d9 3c 08 71  .....<.q                36.1.984      
                                              c8 61 d8 51  e8 41 f8 31  .a.Q.A.1                36.1.992      
                                              12 c1 20 0d  f0 ff 0f 00  .. .....                36.1.1000     
                                              00 41 25 f9  12 c1 f0 09  .A%.....                36.1.1008     
                                              31 c9 21 0c  15 52 44 00  1.!..RD.                36.1.1016     
  16                                1  IN     c0                        .                       37.1.0        
  16                               11  IN     01 07 02 00  07 07 12 20  .......                 38.1.0        
                                              00 00 c0                  ...                     38.1.8        
  16                               26  OUT    c0 00 05 10  00 00 00 00  ........                39.1.0        
                                              00 00 03 00  00 01 00 00  ........                39.1.8        
                                              00 00 18 00  00 a4 ab ff  ........                39.1.16       
                                              3f c0                     ?.                      39.1.24       
  16                                1  IN     c0                        .                       40.1.0        
  16                               11  IN     01 05 02 00  07 07 12 20  .......                 41.1.0        
                                              00 00 c0                  ...                     41.1.8        
  16                              794  OUT    c0 00 07 10  03 5c 00 00  .....\..                42.1.0        
                                              00 00 03 00  00 00 00 00  ........                42.1.8        
                                              00 00 00 00  00 00 00 00  ........                42.1.16       
                                              00 a4 2b ff  3f 05 05 04  ..+.?...                42.1.24       
                                              00 02 03 07  00 03 03 0b  ........                42.1.32       
                                              00 37 06 10  40 6c 06 10  .7..@l..                42.1.40       
                                              40 b1 06 10  40 6f 07 10  @...@o..                42.1.48       
                                              40 91 16 10  40 c6 07 10  @...@...                42.1.56       
                                              40 18 08 10  40 6e 08 10  @...@n..                42.1.64       
                                              40 91 16 10  40 61 09 10  @...@a..                42.1.72       
                                              40 e0 09 10  40 9f 0a 10  @...@...                42.1.80       
                                              40 91 16 10  40 91 16 10  @...@...                42.1.88       
                                              40 3b 0b 10  40 91 16 10  @;..@...                42.1.96       
                                              40 14 0e 10  40 ef 0e 10  @...@...                42.1.104      
                                              40 27 0f 10  40 91 16 10  @'..@...                42.1.112      
                                              40 91 16 10  40 d5 0f 10  @...@...                42.1.120      
                                              40 91 16 10  40 d4 10 10  @...@...                42.1.128      
                                              40 7b 11 10  40 e1 12 10  @...@...                42.1.136      
                                              40 b3 13 10  40 8c 14 10  @...@...                42.1.144      
                                              40 91 16 10  40 91 16 10  @...@...                42.1.152      
                                              40 91 16 10  40 91 16 10  @...@...                42.1.160      
                                              40 bb 15 10  40 91 16 10  @...@...                42.1.168      
                                              40 80 16 10  40 63 0c 10  @...@c..                42.1.176      
                                              40 39 07 10  40 03 15 10  @9..@...                42.1.184      
                                              40 87 09 10  40 d6 08 10  @...@...                42.1.192      
                                              40 7e 09 10  40 0e 16 10  @...@...                42.1.200      
                                              40 58 16 10  40 91 16 10  @X..@...                42.1.208      
                                              40 91 16 10  40 91 16 10  @...@...                42.1.216      
                                              40 91 16 10  40 91 16 10  @...@...                42.1.224      
                                              40 91 16 10  40 91 16 10  @...@...                42.1.232      
                                              40 91 16 10  40 ff 08 10  @...@...                42.1.240      
                                              40 35 09 10  40 19 15 10  @5..@...                42.1.248      
                                              40 01 00 00  00 02 00 00  @.......                42.1.256      
                                              00 03 00 00  00 04 00 00  ........                42.1.264      
                                              00 05 00 00  00 07 00 00  ........                42.1.272      
                                              00 09 00 00  00 0d 00 00  ........                42.1.280      
                                              00 11 00 00  00 19 00 00  ........                42.1.288      
                                              00 21 00 00  00 31 00 00  .!...1..                42.1.296      
                                              00 41 00 00  00 61 00 00  .A...a..                42.1.304      
                                              00 81 00 00  00 c1 00 00  ........                42.1.312      
                                              00 01 01 00  00 81 01 00  ........                42.1.320      
                                              00 01 02 00  00 01 03 00  ........                42.1.328      
                                              00 01 04 00  00 01 06 00  ........                42.1.336      
                                              00 01 08 00  00 01 0c 00  ........                42.1.344      
                                              00 01 10 00  00 01 18 00  ........                42.1.352      
                                              00 01 20 00  00 01 30 00  .. ...0.                42.1.360      
                                              00 01 40 00  00 01 60 00  ..@...`.                42.1.368      
                                              00 00 00 00  00 00 00 00  ........                42.1.376      
                                              00 00 00 00  00 00 00 00  ........                42.1.384      
                                              00 00 00 00  00 00 00 00  ........                42.1.392      
                                              00 01 00 00  00 01 00 00  ........                42.1.400      
                                              00 02 00 00  00 02 00 00  ........                42.1.408      
                                              00 03 00 00  00 03 00 00  ........                42.1.416      
                                              00 04 00 00  00 04 00 00  ........                42.1.424      
                                              00 05 00 00  00 05 00 00  ........                42.1.432      
                                              00 06 00 00  00 06 00 00  ........                42.1.440      
                                              00 07 00 00  00 07 00 00  ........                42.1.448      
                                              00 08 00 00  00 08 00 00  ........                42.1.456      
                                              00 09 00 00  00 09 00 00  ........                42.1.464      
                                              00 0a 00 00  00 0a 00 00  ........                42.1.472      
                                              00 0b 00 00  00 0b 00 00  ........                42.1.480      
                                              00 0c 00 00  00 0c 00 00  ........                42.1.488      
                                              00 0d 00 00  00 0d 00 00  ........                42.1.496      
                                              00 00 00 00  00 00 00 00  ........                42.1.504      
                                              00 03 00 00  00 04 00 00  ........                42.1.512      
                                              00 05 00 00  00 06 00 00  ........                42.1.520      
                                              00 07 00 00  00 08 00 00  ........                42.1.528      
                                              00 09 00 00  00 0a 00 00  ........                42.1.536      
                                              00 0b 00 00  00 0d 00 00  ........                42.1.544      
                                              00 0f 00 00  00 11 00 00  ........                42.1.552      
                                              00 13 00 00  00 17 00 00  ........                42.1.560      
                                              00 1b 00 00  00 1f 00 00  ........                42.1.568      
                                              00 23 00 00  00 2b 00 00  .#...+..                42.1.576      
                                              00 33 00 00  00 3b 00 00  .3...;..                42.1.584      
                                              00 43 00 00  00 53 00 00  .C...S..                42.1.592      
                                              00 63 00 00  00 73 00 00  .c...s..                42.1.600      
                                              00 83 00 00  00 a3 00 00  ........                42.1.608      
                                              00 c3 00 00  00 e3 00 00  ........                42.1.616      
                                              00 02 01 00  00 00 00 00  ........                42.1.624      
                                              00 00 00 00  00 00 00 00  ........                42.1.632      
                                              00 00 00 00  00 00 00 00  ........                42.1.640      
                                              00 00 00 00  00 00 00 00  ........                42.1.648      
                                              00 00 00 00  00 00 00 00  ........                42.1.656      
                                              00 00 00 00  00 01 00 00  ........                42.1.664      
                                              00 01 00 00  00 01 00 00  ........                42.1.672      
                                              00 01 00 00  00 02 00 00  ........                42.1.680      
                                              00 02 00 00  00 02 00 00  ........                42.1.688      
                                              00 02 00 00  00 03 00 00  ........                42.1.696      
                                              00 03 00 00  00 03 00 00  ........                42.1.704      
                                              00 03 00 00  00 04 00 00  ........                42.1.712      
                                              00 04 00 00  00 04 00 00  ........                42.1.720      
                                              00 04 00 00  00 05 00 00  ........                42.1.728      
                                              00 05 00 00  00 05 00 00  ........                42.1.736      
                                              00 05 00 00  00 00 00 00  ........                42.1.744      
                                              00 00 00 00  00 00 00 00  ........                42.1.752      
                                              00 10 11 12  00 08 07 09  ........                42.1.760      
                                              06 0a 05 0b  04 0c 03 0d  ........                42.1.768      
                                              02 0e 01 0f  00 01 01 00  ........                42.1.776      
                                              00 01 00 00  00 04 00 00  ........                42.1.784      
                                              00 c0                     ..                      42.1.792      
  16                                1  IN     c0                        .                       43.1.0        
  16                               11  IN     01 07 02 00  07 07 12 20  .......                 44.1.0        
                                              00 00 c0                  ...                     44.1.8        
  16                               18  OUT    c0 00 06 08  00 00 00 00  ........                45.1.0        
                                              00 00 00 00  00 04 00 10  ........                45.1.8        
                                              40 c0                     @.                      45.1.16       
  16                                1  IN     c0                        .                       46.1.0        
  16                               17  IN     01 06 02 00  07 07 12 20  .......                 47.1.0        
                                              00 00 c0 c0  4f 48 41 49  ....OHAI                47.1.8        
                                              c0                        .                       47.1.16       
  16                               14  OUT    c0 00 0a 04  00 00 00 00  ........                48.1.0        
                                              00 50 00 f0  3f c0        .P..?.                  48.1.8        
  16                                1  IN     c0                        .                       49.1.0        
  16                               11  IN     01 0a 00 00  00 00 3d 9b  ......=.                50.1.0        
                                              00 00 c0                  ...                     50.1.8        
  16                               14  OUT    c0 00 0a 04  00 00 00 00  ........                51.1.0        
                                              00 54 00 f0  3f c0        .T..?.                  51.1.8        
  16                                1  IN     c0                        .                       52.1.0        
  16                               11  IN     01 0a 00 00  58 34 00 02  ....X4..                53.1.0        
                                              00 00 c0                  ...                     53.1.8        
  16                               14  OUT    c0 00 0a 04  00 00 00 00  ........                54.1.0        
                                              00 58 00 f0  3f c0        .X..?.                  54.1.8        
  16                                1  IN     c0                        .                       55.1.0        
  16                               11  IN     01 0a 00 00  00 b0 00 27  .......'                56.1.0        
                                              00 00 c0                  ...                     56.1.8        
  16                               14  OUT    c0 00 0a 04  00 00 00 00  ........                57.1.0        
                                              00 5c 00 f0  3f c0        .\..?.                  57.1.8        
  16                                1  IN     c0                        .                       58.1.0        
  16                               11  IN     01 0a 00 00  eb f3 84 00  ........                59.1.0        
                                              00 00 c0                  ...                     59.1.8        
  16                               14  OUT    c0 00 0a 04  00 00 00 00  ........                60.1.0        
                                              00 14 00 00  60 c0        ....`.                  60.1.8        
  16                                1  IN     c0                        .                       61.1.0        
  16                               11  IN     01 0a 00 00  c9 01 00 00  ........                62.1.0        
                                              00 00 c0                  ...                     62.1.8        
  16                               14  OUT    c0 00 0a 04  00 00 00 00  ........                63.1.0        
                                              00 1c 02 00  60 c0        ....`.                  63.1.8        
  16                                1  IN     c0                        .                       64.1.0        
  16                               11  IN     01 0a 00 00  44 00 00 80  ....D...                65.1.0        
                                              00 00 c0                  ...                     65.1.8        
  16                               14  OUT    c0 00 0a 04  00 00 00 00  ........                66.1.0        
                                              00 24 02 00  60 c0        .$..`.                  66.1.8        
  16                                1  IN     c0                        .                       67.1.0        
  16                               11  IN     01 0a 00 00  00 00 00 70  .......p                68.1.0        
                                              00 00 c0                  ...                     68.1.8        
  16                               26  OUT    c0 00 09 10  00 00 00 00  ........                69.1.0        
                                              00 20 02 00  60 00 17 00  . ..`...                69.1.8        
                                              00 ff ff ff  ff 00 00 00  ........                69.1.16       
                                              00 c0                     ..                      69.1.24       
  16                                1  IN     c0                        .                       70.1.0        
  16                               11  IN     01 09 00 00  00 00 00 00  ........                71.1.0        
                                              00 00 c0                  ...                     71.1.8        
  16                               26  OUT    c0 00 09 10  00 00 00 00  ........                72.1.0        
                                              00 1c 02 00  60 00 00 00  ....`...                72.1.8        
                                              90 ff ff ff  ff 00 00 00  ........                72.1.16       
                                              00 c0                     ..                      72.1.24       
  16                                1  IN     c0                        .                       73.1.0        
  16                               11  IN     01 09 00 00  00 00 00 00  ........                74.1.0        
                                              00 00 c0                  ...                     74.1.8        
  16                               26  OUT    c0 00 09 10  00 00 00 00  ........                75.1.0        
                                              00 24 02 00  60 9f 00 00  .$..`...                75.1.8        
                                              70 ff ff ff  ff 00 00 00  p.......                75.1.16       
                                              00 c0                     ..                      75.1.24       
  16                                1  IN     c0                        .                       76.1.0        
  16                               11  IN     01 09 00 00  00 00 00 00  ........                77.1.0        
                                              00 00 c0                  ...                     77.1.8        
  16                               26  OUT    c0 00 09 10  00 00 00 00  ........                78.1.0        
                                              00 40 02 00  60 00 00 00  .@..`...                78.1.8        
                                              00 ff ff ff  ff 00 00 00  ........                78.1.16       
                                              00 c0                     ..                      78.1.24       
  16                                1  IN     c0                        .                       79.1.0        
  16                               11  IN     01 09 00 00  00 00 00 00  ........                80.1.0        
                                              00 00 c0                  ...                     80.1.8        
  16                               26  OUT    c0 00 09 10  00 00 00 00  ........                81.1.0        
                                              00 00 02 00  60 00 00 04  ....`...                81.1.8        
                                              00 ff ff ff  ff 00 00 00  ........                81.1.16       
                                              00 c0                     ..                      81.1.24       
  16                                1  IN     c0                        .                       82.1.0        
  16                               11  IN     01 09 00 00  00 00 00 00  ........                83.1.0        
                                              00 00 c0                  ...                     83.1.8        
  16                               14  OUT    c0 00 0a 04  00 00 00 00  ........                84.1.0        
                                              00 00 02 00  60 c0        ....`.                  84.1.8        
  16                                1  IN     c0                        .                       85.1.0        
  16                               11  IN     01 0a 00 00  9f 20 00 00  ..... ..                86.1.0        
                                              00 00 c0                  ...                     86.1.8        
  16                               14  OUT    c0 00 0a 04  00 00 00 00  ........                87.1.0        
                                              00 40 02 00  60 c0        .@..`.                  87.1.8        
  16                                1  IN     c0                        .                       88.1.0        
  16                               11  IN     01 0a 00 00  c8 40 15 00  .....@..                89.1.0        
                                              00 00 c0                  ...                     89.1.8        
  16                               26  OUT    c0 00 09 10  00 00 00 00  ........                90.1.0        
                                              00 1c 02 00  60 44 00 00  ....`D..                90.1.8        
                                              80 ff ff ff  ff 00 00 00  ........                90.1.16       
                                              00 c0                     ..                      90.1.24       
  16                                1  IN     c0                        .                       91.1.0        
  16                               11  IN     01 09 00 00  00 00 00 00  ........                92.1.0        
                                              00 00 c0                  ...                     92.1.8        
  16                               26  OUT    c0 00 09 10  00 00 00 00  ........                93.1.0        
                                              00 24 02 00  60 00 00 00  .$..`...                93.1.8        
                                              70 ff ff ff  ff 00 00 00  p.......                93.1.16       
                                              00 c0                     ..                      93.1.24       
  16                                1  IN     c0                        .                       94.1.0        
  16                               11  IN     01 09 00 00  00 00 00 00  ........                95.1.0        
                                              00 00 c0                  ...                     95.1.8        
  16                               34  OUT    c0 00 0b 18  00 00 00 00  ........                96.1.0        
                                              00   00 00 00  00 
					      00 00 00 01  
					      00 00 01 00 
                                              00 10 00 00 
					      00 01 00 00     
                                              ff ff 00 00 c0                     ..                      96.1.32       
  16                                1  IN     c0                        .                       97.1.0        
  16                               11  IN     01 0b 00 00  00 00 00 00  ........                98.1.0        
                                              00 00 c0                  ...                     98.1.8        
  16                               26  OUT    c0 00 02 10  00 00 00 00  ........                99.1.0        
                                              00 00 0c 00  00 01 00 00  ........                99.1.8        
                                              00 00 40 00  00 00 80 00  ..@.....                99.1.16       
                                              00 c0                     ..                      99.1.24       
  16                                1  IN     c0                        .                      100.1.0        
  16                               11  IN     01 02 00 00  00 00 00 00  ........               101.1.0        
                                              00 00 c0                  ...                    101.1.8        
  16                            16410  OUT    c0 00 03 10  40 33 00 00  ....@3..               102.1.0        
                                              00 00 40 00  00 00 00 00  ..@.....               102.1.8        
                                              00 00 00 00  00 00 00 00  ........               102.1.16       
                                              00 aa 50 01  02 00 90 00  ..P.....               102.1.24       
                                              00 00 60 00  00 6e 76 73  ..`..nvs               102.1.32       
                                              00 00 00 00  00 00 00 00  ........               102.1.40       
                                              00 00 00 00  00 00 00 00  ........               102.1.48       
                                              00 aa 50 01  01 00 f0 00  ..P.....               102.1.56       
                                              00 00 10 00  00 70 68 79  .....phy               102.1.64       
                                              5f 69 6e 69  74 00 00 00  _init...               102.1.72       
                                              00 00 00 00  00 00 00 00  ........               102.1.80       
                                              00 aa 50 00  00 00 00 01  ..P.....               102.1.88       
                                              00 00 00 0f  00 66 61 63  .....fac               102.1.96       
                                              74 6f 72 79  00 00 00 00  tory....               102.1.104      
                                              00 00 00 00  00 00 00 00  ........               102.1.112      
                                              00 ff ff ff  ff ff ff ff  ........               102.1.120      
                                              ff ff ff ff  ff ff ff ff  ........               102.1.128      
                                              ff ff ff ff  ff ff ff ff  ........               102.1.136      
                                              ff ff ff ff  ff ff ff ff  ........               102.1.144      
                                              ff ff ff ff  ff ff ff ff  ........               102.1.152      
                                              ff ff ff ff  ff ff ff ff  ........               102.1.160      
                                              ff ff ff ff  ff ff ff ff  ........               102.1.168      
                                              ff ff ff ff  ff ff ff ff  ........               102.1.176      
                                              ff ff ff ff  ff ff ff ff  ........               102.1.184      
                                              ff ff ff ff  ff ff ff ff  ........               102.1.192      
                                              ff ff ff ff  ff ff ff ff  ........               102.1.200      
                                              ff ff ff ff  ff ff ff ff  ........               102.1.208      
                                              ff ff ff ff  ff ff ff ff  ........               102.1.216      
                                              ff ff ff ff  ff ff ff ff  ........               102.1.224      
                                              ff ff ff ff  ff ff ff ff  ........               102.1.232      
                                              ff ff ff ff  ff ff ff ff  ........               102.1.240      
                                              ff ff ff ff  ff ff ff ff  ........               102.1.248      
                                              ff ff ff ff  ff ff ff ff  ........               102.1.256      
                                              ff ff ff ff  ff ff ff ff  ........               102.1.264      
                                              ff ff ff ff  ff ff ff ff  ........               102.1.272      
                                              ff ff ff ff  ff ff ff ff  ........               102.1.280      
                                              ff ff ff ff  ff ff ff ff  ........               102.1.288      
                                              ff ff ff ff  ff ff ff ff  ........               102.1.296      
                                              ff ff ff ff  ff ff ff ff  ........               102.1.304      
                                              ff ff ff ff  ff ff ff ff  ........               102.1.312      
                                              ff ff ff ff  ff ff ff ff  ........               102.1.320      
                                              ff ff ff ff  ff ff ff ff  ........               102.1.328      
                                              ff ff ff ff  ff ff ff ff  ........               102.1.336      
                                              ff ff ff ff  ff ff ff ff  ........               102.1.344      
                                              ff ff ff ff  ff ff ff ff  ........               102.1.352      
                                              ff ff ff ff  ff ff ff ff  ........               102.1.360      
                                              ff ff ff ff  ff ff ff ff  ........               102.1.368      
                                              ff ff ff ff  ff ff ff ff  ........               102.1.376      
                                              ff ff ff ff  ff ff ff ff  ........               102.1.384      
                                              ff ff ff ff  ff ff ff ff  ........               102.1.392      
                                              ff ff ff ff  ff ff ff ff  ........               102.1.400      
                                              ff ff ff ff  ff ff ff ff  ........               102.1.408      
                                              ff ff ff ff  ff ff ff ff  ........               102.1.416      
                                              ff ff ff ff  ff ff ff ff  ........               102.1.424      
                                              ff ff ff ff  ff ff ff ff  ........               102.1.432      
                                              ff ff ff ff  ff ff ff ff  ........               102.1.440      
                                              ff ff ff ff  ff ff ff ff  ........               102.1.448      
                                              ff ff ff ff  ff ff ff ff  ........               102.1.456      
                                              ff ff ff ff  ff ff ff ff  ........               102.1.464      
                                              ff ff ff ff  ff ff ff ff  ........               102.1.472      
                                              ff ff ff ff  ff ff ff ff  ........               102.1.480      
                                              ff ff ff ff  ff ff ff ff  ........               102.1.488      
                                              ff ff ff ff  ff ff ff ff  ........               102.1.496      
                                              ff ff ff ff  ff ff ff ff  ........               102.1.504      
                                              ff ff ff ff  ff ff ff ff  ........               102.1.512      
                                              ff ff ff ff  ff ff ff ff  ........               102.1.520      
                                              ff ff ff ff  ff ff ff ff  ........               102.1.528      
                                              ff ff ff ff  ff ff ff ff  ........               102.1.536      
                                              ff ff ff ff  ff ff ff ff  ........               102.1.544      
                                              ff ff ff ff  ff ff ff ff  ........               102.1.552      
                                              ff ff ff ff  ff ff ff ff  ........               102.1.560      
                                              ff ff ff ff  ff ff ff ff  ........               102.1.568      
                                              ff ff ff ff  ff ff ff ff  ........               102.1.576      
                                              ff ff ff ff  ff ff ff ff  ........               102.1.584      
                                              ff ff ff ff  ff ff ff ff  ........               102.1.592      
                                              ff ff ff ff  ff ff ff ff  ........               102.1.600      
                                              ff ff ff ff  ff ff ff ff  ........               102.1.608      
                                              ff ff ff ff  ff ff ff ff  ........               102.1.616      
                                              ff ff ff ff  ff ff ff ff  ........               102.1.624      
                                              ff ff ff ff  ff ff ff ff  ........               102.1.632      
                                              ff ff ff ff  ff ff ff ff  ........               102.1.640      
                                              ff ff ff ff  ff ff ff ff  ........               102.1.648      
                                              ff ff ff ff  ff ff ff ff  ........               102.1.656      
                                              ff ff ff ff  ff ff ff ff  ........               102.1.664      
                                              ff ff ff ff  ff ff ff ff  ........               102.1.672      
                                              ff ff ff ff  ff ff ff ff  ........               102.1.680      
                                              ff ff ff ff  ff ff ff ff  ........               102.1.688      
                                              ff ff ff ff  ff ff ff ff  ........               102.1.696      
                                              ff ff ff ff  ff ff ff ff  ........               102.1.704      
                                              ff ff ff ff  ff ff ff ff  ........               102.1.712      
                                              ff ff ff ff  ff ff ff ff  ........               102.1.720      
                                              ff ff ff ff  ff ff ff ff  ........               102.1.728      
                                              ff ff ff ff  ff ff ff ff  ........               102.1.736      
                                              ff ff ff ff  ff ff ff ff  ........               102.1.744      
                                              ff ff ff ff  ff ff ff ff  ........               102.1.752      
                                              ff ff ff ff  ff ff ff ff  ........               102.1.760      
                                              ff ff ff ff  ff ff ff ff  ........               102.1.768      
                                              ff ff ff ff  ff ff ff ff  ........               102.1.776      
                                              ff ff ff ff  ff ff ff ff  ........               102.1.784      
                                              ff ff ff ff  ff ff ff ff  ........               102.1.792      
                                              ff ff ff ff  ff ff ff ff  ........               102.1.800      
                                              ff ff ff ff  ff ff ff ff  ........               102.1.808      
                                              ff ff ff ff  ff ff ff ff  ........               102.1.816      
                                              ff ff ff ff  ff ff ff ff  ........               102.1.824      
                                              ff ff ff ff  ff ff ff ff  ........               102.1.832      
                                              ff ff ff ff  ff ff ff ff  ........               102.1.840      
                                              ff ff ff ff  ff ff ff ff  ........               102.1.848      
                                              ff ff ff ff  ff ff ff ff  ........               102.1.856      
                                              ff ff ff ff  ff ff ff ff  ........               102.1.864      
                                              ff ff ff ff  ff ff ff ff  ........               102.1.872      
                                              ff ff ff ff  ff ff ff ff  ........               102.1.880      
                                              ff ff ff ff  ff ff ff ff  ........               102.1.888      
                                              ff ff ff ff  ff ff ff ff  ........               102.1.896      
                                              ff ff ff ff  ff ff ff ff  ........               102.1.904      
                                              ff ff ff ff  ff ff ff ff  ........               102.1.912      
                                              ff ff ff ff  ff ff ff ff  ........               102.1.920      
                                              ff ff ff ff  ff ff ff ff  ........               102.1.928      
                                              ff ff ff ff  ff ff ff ff  ........               102.1.936      
                                              ff ff ff ff  ff ff ff ff  ........               102.1.944      
                                              ff ff ff ff  ff ff ff ff  ........               102.1.952      
                                              ff ff ff ff  ff ff ff ff  ........               102.1.960      
                                              ff ff ff ff  ff ff ff ff  ........               102.1.968      
                                              ff ff ff ff  ff ff ff ff  ........               102.1.976      
                                              ff ff ff ff  ff ff ff ff  ........               102.1.984      
                                              ff ff ff ff  ff ff ff ff  ........               102.1.992      
                                              ff ff ff ff  ff ff ff ff  ........               102.1.1000     
                                              ff ff ff ff  ff ff ff ff  ........               102.1.1008     
                                              ff ff ff ff  ff ff ff ff  ........               102.1.1016     
  16                                1  IN     c0                        .                      103.1.0        
  16                               11  IN     01 03 00 00  00 00 00 00  ........               104.1.0        
                                              00 00 c0                  ...                    104.1.8        
  16                               26  OUT    c0 00 13 10  00 00 00 00  ........               105.1.0        
                                              00 00 80 00  00 00 0c 00  ........               105.1.8        
                                              00 00 00 00  00 00 00 00  ........               105.1.16       
                                              00 c0                     ..                     105.1.24       
  16                                1  IN     c0                        .                      106.1.0        
  16                               28  IN     01 13 00 00  00 00 00 00  ........               107.1.0        
                                              95 2c a7 5a  32 9b 77 38  .,.Z2.w8               107.1.8        
                                              b1 45 db dd  3b 00 71 50  .E..;.qP               107.1.16       
                                              b2 00 00 c0               ....                   107.1.24       
